{
  "schemaVersion": "1.0",
  "matchId": "pair-demo-devon-demo-erin",
  "matchType": "pair",
  "members": [
    "demo-devon",
    "demo-erin"
  ],
  "eligibility": {
    "eligible": false,
    "status": "blocked_by_format",
    "blockingConflicts": [
      {
        "dimension": "format",
        "classification": "blocked_by_format",
        "reason": "The applicants do not share a compatible play format.",
        "evidence": [
          "Erin Moss: online.",
          "Devon Pike: in_person."
        ]
      }
    ]
  },
  "score": {
    "overall": null,
    "baseScore": null,
    "adaptabilityAdjustment": {
      "score": 0,
      "maximum": 5,
      "evidence": []
    },
    "confidence": "low",
    "confidenceNumeric": 44.8,
    "confidenceReasons": [
      "At least one profile is more than 180 days old.",
      "2 profile warning(s) reduce confidence.",
      "One or both profiles are missing important matchmaking information."
    ]
  },
  "dimensionScores": {},
  "classification": "blocked_by_format",
  "strongAlignment": [],
  "manageableDifferences": [],
  "discussionPoints": [],
  "blockingConflicts": [
    {
      "dimension": "format",
      "classification": "blocked_by_format",
      "reason": "The applicants do not share a compatible play format.",
      "evidence": [
        "Erin Moss: online.",
        "Devon Pike: in_person."
      ]
    }
  ],
  "operatorRecommendation": {
    "recommendedAction": "do_not_recommend",
    "requiresHumanApproval": true,
    "introductionReady": false
  },
  "provenance": {
    "scoringModelVersion": "1.0",
    "profileVersions": {
      "demo-erin": 1,
      "demo-devon": 1
    },
    "evaluatedAt": "2026-07-12T23:56:56.579Z"
  }
}
