{
  "schemaVersion": "1.0",
  "matchId": "pair-demo-devon-demo-finn",
  "matchType": "pair",
  "members": [
    "demo-devon",
    "demo-finn"
  ],
  "eligibility": {
    "eligible": false,
    "status": "blocked_by_format",
    "blockingConflicts": [
      {
        "dimension": "format",
        "classification": "blocked_by_format",
        "reason": "The applicants do not share a compatible play format.",
        "evidence": [
          "Finn Mercer: online.",
          "Devon Pike: in_person."
        ]
      }
    ]
  },
  "score": {
    "overall": null,
    "baseScore": null,
    "adaptabilityAdjustment": {
      "score": 0,
      "maximum": 5,
      "evidence": []
    },
    "confidence": "high",
    "confidenceNumeric": 90,
    "confidenceReasons": [
      "Both profiles were confirmed within the last 30 days.",
      "Average profile completeness is 100%."
    ]
  },
  "dimensionScores": {},
  "classification": "blocked_by_format",
  "strongAlignment": [],
  "manageableDifferences": [],
  "discussionPoints": [],
  "blockingConflicts": [
    {
      "dimension": "format",
      "classification": "blocked_by_format",
      "reason": "The applicants do not share a compatible play format.",
      "evidence": [
        "Finn Mercer: online.",
        "Devon Pike: in_person."
      ]
    }
  ],
  "operatorRecommendation": {
    "recommendedAction": "do_not_recommend",
    "requiresHumanApproval": true,
    "introductionReady": false
  },
  "provenance": {
    "scoringModelVersion": "1.0",
    "profileVersions": {
      "demo-finn": 1,
      "demo-devon": 1
    },
    "evaluatedAt": "2026-07-12T23:56:56.796Z"
  }
}
